format,link,tags
"Explore the mysteries of dark matter and energy in the universe.","https://www.space.com/11642-dark-matter-dark-energy-4-percent-universe-panek.html",tech
"Learn how the Python programming language became a powerhouse in the software development world.","https://www.python.org/doc/",tech
"Discover the fascinating history of the Enigma machine and its role in World War II cryptography.","https://www.nationalww2museum.org/war/articles/enigma-machine",tech
"Explore the concept of ""rubber duck debugging"" and how talking to an inanimate object can help solve coding problems.","https://en.wikipedia.org/wiki/Rubber_duck_debugging",debug
"Uncover the architectural marvels of ancient civilizations, such as the Great Pyramid of Giza.","https://www.history.com/topics/ancient-history/the-ancient-egyptians",arch
"Delve into the world of quantum computing and its potential to revolutionize the field of information processing.","https://www.ibm.com/quantum-computing",tech
"Learn about the origins of the internet and its evolution over the years.","https://www.internetsociety.org/internet/history-internet/",tech
"Explore interesting trivia about the development of the first graphical user interface (GUI) at Xerox PARC.","https://www.computerhistory.org/revolution/input-output/14/306",trivia
"Understand the significance of the Turing Test in artificial intelligence and its implications for machine intelligence.","https://plato.stanford.edu/entries/turing-test/",tech
"Discover the debugging technique of ""binary search"" and how it can efficiently locate software bugs.","https://en.wikipedia.org/wiki/Binary_search_algorithm",debug
"Learn about the technological innovations that shaped the Industrial Revolution in the 18th and 19th centuries.","https://www.history.com/topics/industrial-revolution/industrial-revolution",tech
"Explore the fascinating history and evolution of the C programming language.","https://www.learn-c.org/",tech
"Understand the principles of responsive web design and its importance in creating user-friendly websites.","https://www.smashingmagazine.com/2011/01/guidelines-for-responsive-web-design/",tech
"Uncover the secrets of the ancient city of Machu Picchu and its architectural marvels.","https://www.history.com/topics/exploration/machu-picchu",arch
"Learn about the role of debugging in space exploration and the challenges faced by NASA engineers.","https://www.wired.com/story/how-nasa-gets-ready-to-land-on-mars/",debug
"Explore the trivia behind the creation of the first video game, ""Tennis for Two,"" in 1958.","https://www.scientificamerican.com/article/the-first-video-game/",trivia
"Discover the architectural wonders of Antoni Gaudí, including the famous Sagrada Família in Barcelona.","https://www.sagradafamilia.org/en/",arch
"Learn about the debugging practices used in the development of the Linux operating system.","https://opensource.com/article/18/9/debugging-linux",debug
"Explore the technological advancements that led to the creation of the World Wide Web.","https://www.webfoundation.org/about/vision/history-of-the-web/",tech
